Issue,Volume,title,authors,views,citations
327,64,Scoring Rules and the Evaluation of Probability Assessors,Robert L. Winkler,39,59
327,64,Curve Fitting by Segmented Straight Lines,Richard Bellman & Robert Roth,36,52
327,64,Book Reviews,,9,0
326,64,Validation of Consumer Financial Characteristics: Common Stock,"Robert Ferber, John Forsythe, Harold W. Guthrie & E. Scott Maynes",9,6
326,64,Age Patterns of Mortality of American Negroes: 1900–02 to 1959–61,Melvin Zelnik,10,2
326,64,The Accuracy of International Trade Data: The Case of Southeast Asian Countries,Seiji Naya & Theodore Morgan,12,10
326,64,Examples of Likelihoods and Comparison with Point Estimates and Large Sample Approximations,D. A. Sprott & John D. Kalbfleisch,16,16
326,64,Some Aspects of the Statistical Analysis of “Split Plot” Experiments in Completely Randomized Layouts,Gary G. Koch,18,12
326,64,Integer Programming and the Theory of Grouping,Hrishikesh D. Vinod Mathematica,28,50
326,64,The Unrelated Question Randomized Response Model: Theoretical Framework,"Bernard G. Greenberg, Abdel-Latif A. Abul-Ela, Walt R. Simmons & Daniel G. Horvitz",67,191
326,64,An Empirical Study of the Stabilities of Estimators and Variance Estimators in Unequal Probability Sampling of Two Units per Stratum,J. N. K. Rao & D. L. Bayless,16,7
326,64,Planning Some Two-Factor Comparative Surveys,Gordon Booth & J. Sedransk,11,3
326,64,Comparison of Four Ratio-Type Estimates under a Model,Poduri S. R. S. Rao,9,7
326,64,Spectral Properties of Non-Stationary Systems of Linear Stochastic Difference Equations,Gregory C. Chow & Richard E. Levitan,12,1
326,64,An Approximation to the Wilcoxon-Mann-Whitney Distribution,"N. Buckle, C. Kraft & C. van Eeden",11,14
326,64,A Recurrence Relation for Distribution Functions of Order Statistics from Bivariate Distributions,Chandan Kumar Mustafi,10,2
326,64,Discrete Distribution Estimators from the Recurrence Equation for Probabilities,C. A. McGilchrist,9,0
326,64,Two-Sided Tolerance Limits for Normal Populations—Some Improvements,W. G. Howe,76,22
326,64,Life Testing and Reliability Estimation for the Two Parameter Exponential Distribution,S. D. Varde,24,20
326,64,A Table for Estimating the Mean of a Lognormal Distribution,Hanspeter Thöni,10,3
326,64,Critical Values for Bivariate Student t-Tests,F. E. Steffens,8,6
326,64,New Chebyshev Polynomial Approximations to Mills' Ratio,Philip Rabinowitz,11,1
326,64,The Distribution of the Logarithm of the Sum of Two Log-Normal Variates,J. I. Naus,32,31
326,64,Confidence Regions for Variance Ratios of Random Models,L. D. Broemeling,10,13
326,64,The Computation of the Unrestricted AOQL when Defective Material is Removed but Not Replaced,Allen C. Endres,13,1
326,64,Editor's Correction to Approximating the Lower Binomial Confidence Limit,T. W. Anderson & Herman Burstein,8,0
326,64,Book Reviews,,8,0
325,64,Forecasting Short-Term Economic Change,Geoffrey H. Moore,12,4
325,64,A Subjective Evaluation of Bode's Law and an ‘Objective’ Test for Approximate Numerical Rationality,I. J. Good,11,12
325,64,"Discussion of Paper by I. J. Good, April 9, 1968",F. J. Anscombe,9,0
325,64,"Anticipations and Investment Behavior in U. S. Manufacturing, 1947–1960",Dale W. Jorgenson & James A. Stephenson,14,2
325,64,An Econometric Exploration of Indian Saving Behavior,R. Ramanathan,11,0
325,64,Working Life Tables for Males in Ghana 1960,G. M. K. Kpedekpo,10,0
325,64,Some Stochastic Versions of the Matrix Model for Population Dynamics,Z. M. Sykes,15,24
325,64,Play the Winner Rule and the Controlled Clinical Trial,M. Zelen,19,159
325,64,The Multiple Sample Up-and-Down Method in Bioassay,Bartholomew P. Hsi,12,12
325,64,A Solution to the Problem of Linking Multivariate Documents,N. S. D'Andrea Du Bois Jr.,15,7
325,64,Some Methods of Probability Non-Replacement Sampling,R. J. Jessen,14,8
325,64,Concepts of Independence for Proportions with a Generalization of the Dirichlet Distribution,Robert J. Connor & James E. Mosimann,68,100
325,64,Lamst and the Hypotheses of No Three Factor Interaction in Contingency Tables,B. N. Nagnur,9,1
325,64,The Compound Multinomial Distribution and Bayesian Analysis of Categorical Data from Finite Populations,Bruce Hoadley,23,8
325,64,Note on the Multivariate and the Generalized Multivariate Beta Distributions,W. Y. Tan,15,8
325,64,The t-Ratio Distribution,S. James Press,27,14
325,64,Small-Sample Properties of Several Two-Stage Regression Methods in the Context of Auto-Correlated Errors,Potluri Rao & Zvi Griliches,24,33
325,64,On Theil's Mixed Regression Estimator,P. A. V. B. Swamy & J. S. Mehta,16,13
325,64,The Equilibrium Covariance Matrix of Dynamic Econometric Models,John Conlisk,14,3
325,64,Tests for Randomness of Directions against Two Circular Alternatives,M. A. Stephens,10,10
325,64,A Generalization of the T-Method of Multiple Comparisons for Interactions,Pranab Kumar Sen,11,1
325,64,Interval Estimation of the Largest Mean of k Normal Populations with Known Variances,K. M. Lal Saxena & Yung Liang Tong,10,13
325,64,Asymptotic Joint Distribution of Linear Systematic Statistics from Multivariate Distributions,M. M. Siddiqui & Calvin Butler,12,2
325,64,Exact Three-Order-Statistic Confidence Bounds on Reliable Life for a Weibull Model with Progressive Censoring,Nancy R. Mann,17,22
325,64,A New Test for Heteroskedasticity,H. Glejser,29,134
325,64,Simultaneous Confidence Intervals for Variances,D. R. Jensen & M. Q. Jones,17,9
325,64,An Inequality for a Class of Bivariate Chi-Square Distributions,D. R. Jensen,13,13
325,64,Missing Observations in Multivariate Statistics III: Large Sample Analysis of Simple Linear Regression,A. A. Afifi & R. M. Elashoff,18,7
325,64,Missing Observations in Multivariate Statistics—IV: A Note on Simple Linear Regression,A. A. Afifi & R. M. Elashoff,17,3
325,64,Correlation Coefficients Measured on the Same Individuals,Olive Jean Dunn & Virginia Clark,34,70
325,64,Shorter Confidence Intervals Using Prior Observations,J. J. Deely & W. J. Zimmer,10,1
325,64,On the Kolmogorov-Smirnov Test for the Exponential Distribution with Mean Unknown,Hubert W. Lilliefors,100,179
325,64,Book Reviews,,8,0
324,63,"The Analysis of Cross-Classified Data: Independence, Quasi-Independence, and Interactions in Contingency Tables with or without Missing Entries",Leo A. Goodman,45,37
324,63,Dividend Policy: An Empirical Analysis,Eugene F. Fama & Harvey Babiak,188,138
324,63,Maximum Likelihood and Bayesian Estimation of Transition Probabilities,"T. C. Lee, G. G. Judge & A. Zellner",29,22
324,63,Small Sample Properties of Alternative Estimators of Seemingly Unrelated Regressions,Jan Kmenta & Roy F. Gilbert,25,103
324,63,Estimation and Inference for Linear Models in Which Subsets of the Dependent Variable are Constrained,"Timothy W. McGuire, John U. Farley, Robert E. Lucas Jr. & L. Winston Ring",12,8
324,63,The Exact Distribution of a Structural Coefficient Estimator,David H. Richardson,15,23
324,63,On the Power of the Blus Procedure,J. Koerts & A. P. J. Abrahamse,10,10
324,63,Efficiency of the Sample Mean when Residuals Follow a First-Order Stationary Markoff Process,"John S. Chipman, Koteswara Rao Kadiyala, Albert Madansky & John W. Pratt",10,7
324,63,A Note on the Measurement of Cost/Quantity Relationships in the Aircraft Industry,A. R. Gallant,8,5
324,63,A Life Table That Agrees with the Data: II,Nathan Keyfitz,12,4
324,63,An Old Approach to Finite Population Sampling Theory,Richard Royall,20,17
324,63,Several Methods of Re-Designing Area Samples Utilizing Probabilities Proportional to Size when the Sizes Change Significantly,G. B. Gray & R. Platek,8,2
324,63,Approximately Optimal Stratification,R. J. Serfling,25,13
324,63,The Use of a Stratification Variable in Estimation by Proportional Stratified Sampling,Carl-Erik Särndal,22,1
324,63,A Model for Optimum Linkage of Records,Benjamin J. Tepping,16,18
324,63,On Pooling Means when Variance is Unknown,Chien-Pai Han & T. A. Bancroft,17,53
324,63,A Comparative Study of Various Tests for Normality,"S. S. Shapiro, M. B. Wilk & Mrs. H. J. Chen",87,293
324,63,Nonparametric Confidence Regions for Some Multivariate Location Problems,Madan Lal Puri & Pranab Kumar Sen,8,1
324,63,Estimates of the Regression Coefficient Based on Kendall's Tau,Pranab Kumar Sen,346,1614
324,63,Order Statistics for Discrete Populations and for Grouped Samples,H. A. David & R. S. Mishriky,12,12
324,63,On Discrimination Using Qualitative Variables,Ethel S. Gilbert,11,45
324,63,Approximating the Lower Binomial Confidence Limit,T. W. Anderson & Herman Burstein,9,17
324,63,"A Normal Approximation for Binomial, F, Beta, and other Common, Related Tail Probabilities, I",David B. Peizer & John W. Pratt,58,30
324,63,"A Normal Approximation for Binomial, F, Beta, and other Common, Related Tail Probabilities, II",John W. Pratt,35,19
324,63,Statistical Dependence between Subclass Means and the Numbers of Observations in the Subclasses for the Two-Way Completely-Random Classification,David A. Harville,8,2
324,63,Cubical and Spherical Estimation of Multivariate Probability Density,Thomas A. Elkins,11,6
324,63,On the Inverse Gaussian Distribution Function,Jonathan Shuster,66,41
324,63,Estimating Finite-Time Maxima and Minima of a Stationary Gaussian Ornstein-Uhlenbeck Process by Monte Carlo Simulation,Irving I. Gringorten,9,1
324,63,How Deviant Can You Be?,Paul A. Samuelson,24,36
324,63,Constructing an Unbiased Random Sequence,Paul A. Samuelson,13,7
324,63,Book Reviews,,10,0
324,63,Corrigenda,,9,0
324,63,Editorial Board Page,,7,0
323,63,Crossroad Choices for the Future Development of the Federal Statistical System,Raymond T. Bowman,4,0
323,63,Some Properties of Symmetric Stable Distributions,Eugene F. Fama & Richard Roll,26,46
323,63,Statistical Inference in the Classical Occupancy Problem Unbiased Estimation of the Number of Classes,Bernard Harris,7,15
323,63,Parameter Estimation for a Multivariate Exponential Distribution,Barry C. Arnold,15,8
323,63,Some Tests of Hypotheses Concerning the Three-Parameter Weibull Distribution,Lee J. Bain & Darrel R. Thoman,7,3
323,63,Estimation of the Larger of Two Normal Means,Saul Blumenthal & Arthur Cohen,8,15
323,63,Analysis of Extreme-Value Data by Sample Quantiles for Very Large Samples,Khatab M. Hassanein,6,5
323,63,"Maximum-Likelihood Estimation, from Doubly Censored Samples, of the Parameters of the First Asymptotic Distribution of Extreme Values",H. Leon Harter & Albert H. Moore,14,28
323,63,An Empirical Study into Factors Affecting the F-Test Under Permutation for the Randomized Block Design,Frank B. Baker & R. O. Collier,4,3
323,63,Accuracy of an Approximation to the Power of the Chi-Square Goodness of Fit Test with Small but Equal Expected Frequencies,Malcolm J. Slakter,4,6
323,63,Kolmogorov-Smirnov Tests of Fit Based on Some General Bounds,Giitiro Suzuki,6,1
323,63,The Estimation of Probability Densities and Cumulatives by Fourier Series Methods,R. Kronmal & M. Tarter,11,30
323,63,Accuracy Borrowing in the Estimation of the Mean by Shrinkage to an Interval,James R. Thompson,5,9
323,63,Optimal Allocation in Stratified and Multistage Samples Using Prior Information,W. A. Ericson,8,2
323,63,Use of Domain Estimators with Unequal Probability in Sample Surveys,James R. Conner & Delane E. Welsch,4,0
323,63,A Two-State Markov Model for Behavioral Change,Mary H. Regier,5,1
323,63,Negative Variance Estimates and Statistical Dependence in Nested Sampling,Richahd B. McHugh & Paul W. Mielke,6,1
323,63,Series Representations of the Doubly Noncentral t-Distribution,Marakatha Krishnan,5,8
323,63,A Note on Representations of the Doubly Non-Central t Distribution,W. G. Bulgren & D. E. Amos,11,10
323,63,Confidence Bands in Linear Regression with Constraints on the Independent Variables,Max Halperin & Joan Gurian,5,15
323,63,A Note on Confidence Bands for a Regression Line over a Finite Range,Olive Jean Dunn,5,5
323,63,A Note on Log-Linear Regression,Dale M. Heien,10,4
323,63,A Note on Estimating the Mean of a Normal Distribution with Known Coefficient of Variation,Rasul A. Khan,5,15
323,63,A Note on Linear Regression in Trivariate Distributions,G. K. Eagleson,4,1
323,63,"Dictionary/Outline of Basic Statistics. John E. Freund and Frank J. Williams. McGraw-Hill Book Company, 1966. pp. x, 195. $2.95.",John Neter,4,0
323,63,"Handbook of Methods of Applied Statistics. Volume I: Techniques of Computation Descriptive Methods, and Statistical Inference. Volume II: Planning of Surveys and Experiments. I. M. Chakravarti, R. G. Laha, and J. Roy, New York, John Wiley; 1967, $9.00.",Marvin Karson,9,0
323,63,"Beat the Market: A Scientific Stock Market System. Edward O. Thorp and Sheen T. Kassouf (Random House, New York, 1967), 221 pages, $7.95.",Paul Samuelson,16,0
323,63,"Cyclical Fluctuations in the Exports of the United States Since 1879. Ilse Mintz, New York: Columbia University Press, 1967, 10.",Marina v. N. Whitman,4,0
323,63,"Information, Expectations, and Inventory Fluctuation: A Study of Materials Stock on Hand and on Order. Ruth P. Mack. New York: National Bureau of Economic Research (Distributed by Columbia University Press), 1967. Pp. xiv, 306. $10.00.",David A. Belsley,4,0
323,63,"Advertising and Competition. Jules Backman. New York University Press, 1967. $5.00.",James H. S. Pierson,5,0
323,63,"Survey Research in the Social Sciences. Edited by Charles Y. Glock. New York: Russell Sage Foundation, 1967. pp xxi, 543. $9.00.",Philip J. McCarthy,4,0
323,63,"Models, Methods and Analytical Procedures in Education Research, Joseph E. Hill and August Kerber. Wayne State University Press, Detroit. 1967. Pp. XIV, 550. $19.95.",Janet D. Elashoff,5,0
323,63,"Stationary Random Processes. Yu. A. Rozanov (translated from Russian by A. Feinstein). San Francisco: Holden-Day, 1967, 211 pp. $10.95.",M. M. Siddiqui,15,0
323,63,"Probability Measures on Metric Spaces. K. R. Parthasarathy, Academic Press, New York, 1967, pp. 276, $12.00.",B. L. S. Prakasa Rao,10,0
323,63,"Stochastically Dependent Equations: An Introductory Text for Econometricians. P. R. Fisk. Griffin's Statistical Monographs and Courses No. 21. London: Charles Griffin and Co.; New York: Hafner Publishing Co., 1967. pp. 181.",Walter D. Fisher,5,0
323,63,"Nonlinear Programming. J. Abadie (ed.). New York: John Wiley, 1967. Pp. xxii, 316.",Arthur F. Veinott,8,0
323,63,"Fortran Programs for Economists (DAE Occasional Papers, 13), Lucy Joan Slater, Cambridge University Press, Cambridge, 1967, 160 pp., $3.50, paper.",Paul D. Minton,4,0
323,63,"Formulae and Tables for Statistical Work, C. R. Rao, S. K. Mitra, and A. Matthai. Calcutta: Statistical Publishing Company, 1966. 234+xii.",,7,0
322,63,Convergence of a Human Population to a Stable Form,Ansley J. Coale,4,1
322,63,Selected Economic Data—Accuracy vs. Reporting Speed,H. O. Stekler & Susan W. Burch,5,1
322,63,Linear Approximations to the Census and BLS Seasonal Adjustment Methods,Allan H. Young,4,12
322,63,Spectral Evaluation of BLS and Census Revised Seasonal Adjustment Procedures,Harry M. Rosenblatt,5,7
322,63,Functional Form in the Demand for Money,Paul Zarembka,4,15
322,63,Standard Errors for Indexes From Complex Samples,Leslie Kish,4,4
322,63,Multivariate Stratified Surveys,Samprit Chatterjee,4,9
322,63,On Product Moments From a Finite Universe,S. N. Nath,5,6
322,63,Multinomial Sampling With Partially Categorized Data,Saul Blumenthal,12,5
322,63,Estimation in a Heteroscedastic Regression Model,Herbert C. Rutemiller & David A. Bowers,15,16
322,63,A Test of the Mean Square Error Criterion for Restrictions in Linear Regression,Carlos Toro-Vizcarrondo & T. D. Wallace,29,34
322,63,Simultaneous Estimation by Partial Totals for Compartmental Models,John J. Beauchamp & Richard G. Cornell,4,1
322,63,Some Estimators for a Linear Model With Random Coefficients,Clifford Hildreth & James P. Houck,36,55
322,63,Improved Estimators for Coefficients in Linear Regression,Stanley L. Sclove,12,25
322,63,A Modified Compound Poisson Process with Normal Compounding,S. James Press,10,1
322,63,Two k-Sample Slippage Tests,W. J. Conover,4,1
322,63,On A General System of Distributions I. Its Curve-Shape Characteristics II. The Sample Median,Irving W. Burr & Peter J. Cislak,11,13
322,63,On A General System of Distributions III. The Sample Range,Irving W. Burr,20,4
322,63,Fractional Replications of 2p Factorial Experiments With the Factors Applied Sequentially,R. R. Prairie & W. J. Zimmer,4,0
322,63,Optimal Sample Size in Two-Action Problems When the Sample Observations Are Lognormal and the Precision h Is Known,Gordon M. Kaufman,4,1
322,63,Robustness of the F-Test to Errors of Both Kinds and the Correlation Between the Numerator and Denominator of the F-Ratio,Theodore S. Donaldson,7,10
322,63,Posterior Distribution of Percentiles: Bayes' Theorem for Sampling From a Population,Bruce M. Hill,15,28
322,63,The First-Median Test: A Two-Sided Version of the Control Median Test,J. L. Gastwirth,10,9
322,63,Certain Uncorrelated Nonparametric Test Statistics,Myles Hollander,6,3
322,63,On the Evaluation of Distribution Functions,H. L. Gray & W. R. Schucany,4,4
322,63,"Mathematical Statistics: A Decision Theoretic Approach. Thomas S. Ferguson. New York and London: Academic Press Inc., 1967. Pp. xi, 396. $14.50",Myles Hollander,37,0
322,63,"Probability: a survey of the mathematical theory. J. Lamperti. Vol. 2 of Mathematics Monographs Series, Edited by R. Gunning and H. Rossi. W. A. Benjamin, Inc. New York, 1966. X + 150 pp.",F. Eicker,6,0
322,63,"Essays in Mathematical Economics. Edited by Martin Shubik. Princeton, New Jersey: Princeton University Press, 1967, pp. XX, 475.",Michael D. Intriligator,4,0
322,63,"Mathematics and Statistics for Scientists and Engineers. P. Macdonald. London, Toronto and New York: D. Van Nostrand and Co., Ltd., 1966. Pp. XII + 299.",B. W. Conolly,4,0
322,63,"Modern Statistics for Behavioral Sciences. Daniel S. Lordahl, New York: The Ronald Press Company, 1967. Pp. Xii, 365. $8.00",James C. Smith,4,0
322,63,"Statistical Analysis for Areal Distribution. David S. Neft, Regional Science Research Institute, Monograph series, No. 2. Regional Science Research Institute, Philadelphia, 1966. S4.75. vii and 172 pp.",D. Michael Ray,4,0
322,63,"Elements of Nonparametric Statistics, Gottfried E. Noether, New York, John Wiley. Pp. X, 104.",Elizabeth H. Yen,10,0
322,63,"Elementary Sampling Theory, Taro Yamane. Englewood Cliffs, New Jersey: Prentice-Hall, Inc., 1967. Pp. x–405.",Benjamin J. Tepping,7,0
322,63,"Advanced Seminar on Spectral Analysis of Time Series. Edited by Bernard Harris. New York: John Wiley and Sons, Inc. 1967. $7.95.",Richard H. Jones,4,0
322,63,"Techniques of Production Control: Monograph No. 1, Mathematical Trend Curves: An Aid to Forecasting, J. V. Gregg, et al; Monograph No. 2, Short-term Forecasting, G. A. Coulie, et al; Monograph No. 3, Cumulative Sum Techniques, R. H. Woodward and P. L. Goldsmith. Imperial Chemical Industries Ltd., published by Oliver and Boyd, Edinburgh and London, 1966. Pp. xxiv, 201. $8.00.",Irving W. Burr,4,0
322,63,"Studies in the Economics of Income Maintenance. Henry Aaron, Charles Warden, Jr., Lora S. Collins, and John W. Dorsey. Otto Eckstein, Editor. The Brookings Institution 1967",Dorothy S. Projector,4,0
322,63,"Housing Construction Statistics 1889 to 1964. U. S. Bureau of the Census, U. S. Dept. of Commerce, Gov. Printing Ofc., prepared under the direction of Thelma R. Wright. $6.00 L.C. Card No. A66-7417, 805 pp.",Manuel Gottlieb,4,0
322,63,"Introduction to Numerical Methods and Fortran Programming. Thomas R. McCalla. John Wiley and Sons, Inc., 359 pp. $7.95",George L. Cain,10,0
322,63,"Tables of the Incomplete Gamma Function Ratio. S. H. Khamis, and W. Rudert. Justus von Liebig Verlag, Darmstadt, Germany, 1965. xlix+412 pp.; DM 42.",George J. Resnikoff,4,0
322,63,"Applied General Statistics, Third Edition. F. E. Croxton, D. J. Cowden, S. Klein, Prentice-Hall, Inc., Englewood Cliffs, N. J. 1967",,10,0
322,63,Notes About Authors,,4,0
322,63,Publications Received,,5,0
322,63,"Summaries of Papers Delivered at the 127th Annual Meeting of the American Statistical Association, Washington, D. C., December 27–30, 1967",,5,0
322,63,1967 Report of the Board of Duectors,,4,0
322,63,1967 Report of the Secretary-Treasurer,,4,0
321,63,Association and Estimation in Contingency Tables,Frederick Mosteller,35,36
321,63,On Measuring the Extreme Aged in the Population,Ira Rosenwaike,4,2
321,63,Recent Research in Reinterview Procedures,Barbara A. Bailar,4,2
321,63,The Analysis of Variance of Data from Stratified Subsamples,Howard L. Jones,5,0
321,63,Some Nonresponse Sampling Theory When the Frame Contains an Unknown Amount of Duplication,J. N. K. Rao,6,0
321,63,Bounds for the Error-Variance of an Estimator in Sampling with Varying Probabilities from a Finite Population,S. G. Prabhu Ajgaonkar,5,0
321,63,Estimates in Successive Sampling Using a Multi-Stage Design,D. Singh,5,1
321,63,Some Shrinkage Techniques for Estimating the Mean,James R. Thompson,8,38
321,63,Estimating from Misclassified Data,S. James Press,5,1
321,63,Estimating the Parameters of Log-Normal Distribution from Censored Samples,M. L. Tiku,16,16
321,63,Estimation of the Innovation Variance of a Stationary Time Series,Herbert T. Davis & Richard H. Jones,8,7
321,63,Estimation of the Parameter n in the Binomial Distribution,Dorian Feldman & Martin Fox,31,17
321,63,Estimation of Parameters in the Multivariate Normal Distribution with Missing Observations,R. R. Hocking & Wm. B. Smith,14,17
321,63,Bayesian Estimation of Means for the Random Effect Model,G. E. P. Box & G. C. Tiao,17,8
321,63,Grouping Estimators on Heteroscedastic Data,Tony Lancaster,5,2
321,63,Applications of Time-Shared Computers in a Statistics Curriculum,Martin Schatzoff,5,2
321,63,A Chance Mechanism of the Variation in the Number of Births Per Couple,S. N. Singh,4,0
321,63,Minimizing Response Errors in Financial Data: the Possibilities,E. Scott Maynes,4,3
321,63,Market Growth and Industry Concentration,David R. Kamerschen,4,2
321,63,A Simplification of the BLUS Procedure for Analyzing Regression Disturbances,Henri Theil,4,12
321,63,On Cash Equivalents and Information Evaluation in Decisions Under Uncertainty Part I: Basic Theory,Irving H. LaValle,9,3
321,63,On Cash Equivalents and Information Evaluation in Decisions Under Uncertainty Part II: Incremental Information Decisions,Irving H. LaValle,5,1
321,63,On Cash Equivalents and Information Evaluation in Decisions Under Uncertainty Part III: Exchanging Partition-J for Partition-K Information,Irving H. LaValle,4,0
321,63,Optimum Choice of Classes for Contingency Tables,M. A. Hamdan,4,1
321,63,Bias In Multinomial Classification,P. Krishnaswami & Rajkshwar Nath,7,1
321,63,An Algorithm for the Determination of the Economic Design of -Charts Based on Duncan's Model,"A. L. Goel, S. C. Jain & S. M. Wu",5,27
321,63,"The Inversion of Cumulant Operators for Power-Series Distributions, and the Approximate Stabilization of Variance by Transformations",M. C. K. Tweedie & A. Veevers,5,0
321,63,Generalized Hyperbolic Secant Distributions,W. L. Harkness & M. L. Harkness,9,9
321,63,Robustness of Sum of Squared Ranks Test,Benjamin S. Duran & Paul W. Mielke,6,9
321,63,An Investigation into the Small Sample Properties of a Two Sample Test of Lehmann's,"A. A. Afifi, R. M. Elashoff & P. G. Langley",5,0
321,63,Recursive Generation of the Distribution of Several Non-Parametric Test Statistics Under Censoring,Roger A. Shorack,4,2
321,63,"Technology, Economic Growth and Public Policy, Richard R. Nelson, Merton J. Peck, and Edward D. Kalachek, A Rand Corporation and Brookings Institution Study, The Brookings Institution, Washington, D.C., 1967.",Murray Brown,4,0
321,63,"An Introduction to Mathematical Learning Theory. Richard C. Atkinson, Gordon H. Bower, and Edward J. Crothers. John Wiley & Sons, New York, 1965.",Wayne Lee,6,0
321,63,"Problems in Mathematical Learning Theory. William H. Batchelder, Robert A. Bjork, and John I. Yellott, Jr., John Wiley & Sons, New York, 1966.",Wayne Lee,4,0
321,63,"The Selected Papers of E. S. Pearson, Cambridge University Press (for the Biometrika Trustees) 1966",Norman L. Johnson,4,0
321,63,"Applied Queueing Theory. Alec M. Lee, St. Martin's Press, 1966, 244 pages, $8.50",Frederick S. Hillier,4,0
321,63,"Elementary Probability. Edward O. Thorp. New York: John Wiley & Sons, 1966, Pp. 152.",Arthur Cohen,7,0
321,63,"Statistical Computations on a Digital Computer, W. Hemmerle. Blaisdell Publishing Company, 1967. Pp. 230. $7.50.",John W. Hamblen,4,0
321,63,"Multivariate Statistical Programs. Dean J. Clyde, Elliot M. Cramer, Richard J. Sherin. Coral Gables, Florida. Biometric Laboratory, University of Miami, 1966. Paperbound.",Herman P. Friedman,4,0
321,63,"Mathematical Methods for Digital Computers, Volume II. Anthony Ralston and Herbert S. Wilf (eds.) New York: John Wiley & Sons, Inc. 1967.",Thomas G. Newman,9,0
321,63,"Fundamentals of Behavioral Statistics. Richard P. Runyon and Audrey Haber, Reading, Massachusetts: Addison-Wesley Publishing Company, Inc. 1967. pp. 304. $6.95.",William C. Guenther,4,0
321,63,"Test Theory. D. Magnusson, Reading, Massachusetts: Addison-Wesley Publishing Company, 1966.",M. A. Aitkin,4,0
321,63,"Econometric Techniques and Problems. C. E. V. Leser: Hafner Publishing Co., New York, 1966, pp. 120+Viii.",G. S. Maddala,4,0
321,63,"Housing Construction Statistics 1889 to 1964. U.S. Bureau of the Census, U.S. Dept of Commerce, Gov. Printing Ofc., prepared under the direction of Thelma R. Wright. $6.00 L.C. Card No. A66-7417, 805 pp.",Manuel Gottlieb,4,0
321,63,"Readings in Mathematical Social Sciences. Paul F. Lazarsfeld and Neil W. Henry (ed.). Chicago: Science Research Associates, Inc., 1966, pp. 371, $10.50.",,6,0
321,63,"Correction to Order Statistics Estimators of the Location of the Cauchy Distribution by V. D. Barnett, JASA, Vol. 61, No. 316 (December, 1966), 1205–1218.",,5,0
